{
  "$schema": "http://json-schema.org/draft-07/schema#",
  "$id": "https://github.com/microsoft/mxc/schemas/stable/mxc-config.schema.0.5.0-alpha-strict.json",
  "title": "MXC Configuration",
  "description": "Strict view of the 0.5.0-alpha contract: only the non-experimental backends and the stable fields. Identical wire-version-compatible alternative to mxc-config.schema.0.5.0-alpha.json (which is preserved unmodified per the immutability rule). Point $schema here when you want editor validation to flag experimental shapes as errors; use the original 0.5.0-alpha.json (or, preferably, the dev schema) when you genuinely use experimental fields.",
  "type": "object",

  "required": ["process"],

  "properties": {
    "version": {
      "type": "string",
      "description": "MXC config schema version (semver). Current: '0.5.0-alpha'.",
      "examples": ["0.5.0-alpha"]
    },
    "containerId": {
      "type": "string",
      "description": "Externally assigned container identifier."
    },
    "containment": {
      "type": "string",
      "enum": ["appcontainer", "lxc"],
      "default": "appcontainer",
      "description": "Containment backend to use for execution. This strict view lists only the non-experimental backends. The parser additionally accepts 'windows_sandbox', 'wslc', 'microvm', and 'macos_sandbox' (experimental — require --experimental at runtime); validate against the dev schema if you use them."
    },

    "lifecycle": {
      "type": "object",
      "description": "Container lifecycle settings shared across all backends.",
      "properties": {
        "destroyOnExit": {
          "type": "boolean",
          "default": true,
          "description": "Destroy the container after execution completes."
        },
        "preservePolicy": {
          "type": "boolean",
          "default": false,
          "description": "If true, retain filesystem and network policies after execution. If false (default), policies are cleaned up on exit."
        }
      }
    },

    "process": {
      "type": "object",
      "description": "Process execution settings.",
      "required": ["commandLine"],
      "properties": {
        "commandLine": {
          "type": "string",
          "minLength": 1,
          "description": "Complete command line to execute (e.g., \"python3 app.py\")."
        },
        "cwd": {
          "type": "string",
          "description": "Working directory for the process."
        },
        "env": {
          "type": "array",
          "items": { "type": "string" },
          "description": "Environment variables as KEY=VALUE strings.",
          "examples": [["MY_VAR=value", "PATH=/usr/bin"]]
        },
        "timeout": {
          "type": "integer",
          "minimum": 0,
          "default": 0,
          "description": "Execution timeout in milliseconds. 0 = no timeout (infinite)."
        }
      }
    },

    "filesystem": {
      "type": "object",
      "description": "Filesystem access policy. Shared across all backends.",
      "properties": {
        "readwritePaths": {
          "type": "array",
          "items": { "type": "string" },
          "default": [],
          "description": "Paths the process can read and write."
        },
        "readonlyPaths": {
          "type": "array",
          "items": { "type": "string" },
          "default": [],
          "description": "Paths the process can read but not write."
        },
        "deniedPaths": {
          "type": "array",
          "items": { "type": "string" },
          "default": [],
          "description": "Paths the process cannot access at all."
        }
      }
    },

    "network": {
      "type": "object",
      "description": "Network access policy. Shared across all backends.",
      "properties": {
        "defaultPolicy": {
          "type": "string",
          "enum": ["allow", "block"],
          "default": "allow",
          "description": "Default network posture."
        },
        "enforcementMode": {
          "type": "string",
          "enum": ["capabilities", "firewall", "both"],
          "default": "capabilities",
          "description": "How network policy is enforced."
        },
        "allowedHosts": {
          "type": "array",
          "items": { "type": "string" },
          "description": "Hostnames or IP/CIDR blocks to allow (when defaultPolicy is 'block'). Enforced by 'lxc' and 'appcontainer' containment backends."
        },
        "blockedHosts": {
          "type": "array",
          "items": { "type": "string" },
          "description": "Hostnames or IP addresses to block (when defaultPolicy is 'allow'). Enforced by 'lxc' and 'appcontainer' containment backends."
        },
        "proxy": {
          "type": "object",
          "description": "Proxy configuration. Only supported with appcontainer backend.",
          "oneOf": [
            {
              "properties": {
                "localhost": {
                  "type": "integer",
                  "minimum": 1,
                  "maximum": 65535,
                  "description": "Port of an external already running proxy on localhost."
                }
              },
              "required": ["localhost"],
              "additionalProperties": false
            },
            {
              "properties": {
                "builtinTestServer": {
                  "type": "boolean",
                  "const": true,
                  "description": "Use WXC's built-in test proxy server. Mutually exclusive with localhost."
                }
              },
              "required": ["builtinTestServer"],
              "additionalProperties": false
            },
            {
              "properties": {
                "url": {
                  "type": "string",
                  "description": "Full proxy URL including port (e.g., http://proxy.example.com:8080)."
                }
              },
              "required": ["url"],
              "additionalProperties": false
            }
          ]
        }
      }
    },

    "ui": {
      "type": "object",
      "description": "Cross-platform UI policy. Mapped from SandboxPolicy.ui by createConfigFromPolicy.",
      "properties": {
        "disable": {
          "type": "boolean",
          "default": true,
          "description": "Whether UI is disabled (no visible windows)."
        },
        "clipboard": {
          "type": "string",
          "enum": ["none", "read", "write", "all"],
          "default": "none",
          "description": "Clipboard access level."
        },
        "injection": {
          "type": "boolean",
          "default": false,
          "description": "Whether input injection (keyboard/mouse) is allowed."
        }
      }
    },

    "appContainer": {
      "type": "object",
      "description": "AppContainer-specific settings. Used when containment is 'appcontainer'.",
      "properties": {
        "leastPrivilege": {
          "type": "boolean",
          "default": false,
          "description": "Enforce least privilege mode."
        },
        "capabilities": {
          "type": "array",
          "items": { "type": "string" },
          "default": [],
          "description": "AppContainer capabilities (e.g., 'internetClient', 'registryRead')."
        },
        "ui": {
          "type": "object",
          "description": "BaseProcessContainer-specific UI settings (Windows only).",
          "properties": {
            "isolation": {
              "type": "string",
              "enum": ["desktop", "handles", "atoms", "container"],
              "default": "container",
              "description": "UI isolation level for the desktop."
            },
            "desktopSystemControl": {
              "type": "boolean",
              "default": false,
              "description": "Whether desktop system control is allowed."
            },
            "systemSettings": {
              "type": "string",
              "default": "none",
              "description": "System settings access level."
            },
            "ime": {
              "type": "boolean",
              "default": false,
              "description": "Whether IME (Input Method Editor) is allowed."
            }
          }
        }
      }
    },

    "lxc": {
      "type": "object",
      "description": "LXC-specific settings. Used when containment is 'lxc'.",
      "required": ["distribution", "release"],
      "properties": {
        "distribution": {
          "type": "string",
          "description": "Linux distribution for the container rootfs (e.g., 'alpine', 'ubuntu'). Required."
        },
        "release": {
          "type": "string",
          "description": "Distribution release version (e.g., '3.20', '24.04'). Required."
        }
      }
    }
  }
}
