{
  "version": "0.4.0-alpha",
  "containerId": "UI-Test-01",
  "containment": "appcontainer",
  "process": {
    "commandLine": "cmd.exe /c echo PASS: process ran with Win32k disabled",
    "timeout": 15000
  },
  "appContainer": {
    "capabilities": []
  },
  "ui": {
    "disable": true,
    "clipboard": "none",
    "injection": false,
    "isolation": "container",
    "desktopSystemControl": false,
    "systemSettings": "none",
    "ime": false
  }
}
